{
  "schema_version": 1,
  "kind": "storage_apply_record",
  "record_id": "apply-fixture",
  "created_at": "2026-08-14T00:00:00+00:00",
  "plan_id": "plan-fixture",
  "plan_sha256": "cccccccccccccccccccccccccccccccccccccccccccccccccccccccccccccccc",
  "action_id": "storage.trash-stage",
  "action_class": "trash",
  "status": "applied_replan_required",
  "target_free_bytes": 53687091200,
  "free_bytes_before": 42949672960,
  "free_bytes_after": 42949672960,
  "estimated_reclaimable_bytes": 2147483648,
  "staged_bytes": 2147483648,
  "measured_reclaimed_bytes": 0,
  "actions": [{"candidate_id": "storage-fixture", "status": "staged"}],
  "trash_manifest": [{"candidate_id": "storage-fixture", "trash_path": "~/.Trash/example.zip"}],
  "time_machine": {"status": "warning_only", "blocking": false},
  "replan_required": true
}
